/US FEDERAL GOVERNMENT/[budget] Nuclear Regulatory Commission (429)/[budget] Nuclear Regulatory Commission (429-0)/[budget] Office of Inspector General (429-0-300),[budget] Office of Inspector General (429-0-300),11000,12000,13000,14000,16000,19000,300,Office of Inspector General,429,Nuclear Regulatory Commission,account,0,Nuclear Regulatory Commission,429-0-300,Office of Inspector General
/US FEDERAL GOVERNMENT/[budget] Public Defender Service for the District of Columbia (587)/[budget] Public Defender Service for the District of Columbia (587-0)/[budget] Federal Payment to the District of Columbia Public Defender Service (587-0-1733),[budget] Federal Payment to the District of Columbia Public Defender Service (587-0-1733),41000,40000,44000,48000,60000,59000,1733,Federal Payment to the District of Columbia Public Defender Service,587,Public Defender Service for the District of Columbia,account,0,Public Defender Service for the District of Columbia,587-0-1733,Federal Payment to the District of Columbia Public Defender Service
/US FEDERAL GOVERNMENT/[budget] Department of Defense--Military Programs (7)/[budget] Procurement (7-15)/[budget] Defense Production Act Program (7-15-361),[budget] Defense Production Act Program (7-15-361),0,0,6000,4000,4000,4000,361,Defense Production Act Program,7,Department of Defense--Military Programs,account,15,Procurement,7-15-361,Defense Production Act Program
/US FEDERAL GOVERNMENT/[budget] Department of Defense--Military Programs (7)/[budget] Military Construction (7-25)/[budget] North Atlantic Treaty Organization Security Investment Program (7-25-804),[budget] North Atlantic Treaty Organization Security Investment Program (7-25-804),128000,86000,209000,171000,448000,438000,804,North Atlantic Treaty Organization Security Investment Program,7,Department of Defense--Military Programs,account,25,Military Construction,7-25-804,North Atlantic Treaty Organization Security Investment Program
/US FEDERAL GOVERNMENT/[budget] Department of Defense--Military Programs (7)/[budget] Operation and Maintenance (7-10)/[budget] Defense Health Program (7-10-130),[budget] Defense Health Program (7-10-130),33801000,34094000,34911000,35926000,39365000,38674000,130,Defense Health Program,7,Department of Defense--Military Programs,account,10,Operation and Maintenance,7-10-130,Defense Health Program
/US FEDERAL GOVERNMENT/[budget] Department of Defense--Military Programs (7)/[budget] Operation and Maintenance (7-10)/[budget] Office of the Inspector General (7-10-107),[budget] Office of the Inspector General (7-10-107),355000,386000,409000,436000,415000,511000,107,Office of the Inspector General,7,Department of Defense--Military Programs,account,10,Operation and Maintenance,7-10-107,Office of the Inspector General
/US FEDERAL GOVERNMENT/[budget] Corporation for National and Community Service (485)/[budget] Corporation for National and Community Service (485-0)/[budget] Office of Inspector General (485-0-2721),[budget] Office of Inspector General (485-0-2721),5000,6000,5000,7000,7000,8000,2721,Office of Inspector General,485,Corporation for National and Community Service,account,0,Corporation for National and Community Service,485-0-2721,Office of Inspector General
/US FEDERAL GOVERNMENT/[budget] Legislative Branch (1)/[budget] Joint Items (1-11)/[budget] Office of Congressional Accessibility Services (1-11-190),[budget] Office of Congressional Accessibility Services (1-11-190),1000,1000,1000,2000,3000,2000,190,Office of Congressional Accessibility Services,1,Legislative Branch,account,11,Joint Items,1-11-190,Office of Congressional Accessibility Services
/US FEDERAL GOVERNMENT/[budget] Legislative Branch (1)/[budget] Joint Items (1-11)/[budget] Joint Congressional Committee on Inaugural Ceremonies of 2025 (1-11-186),[budget] Joint Congressional Committee on Inaugural Ceremonies of 2025 (1-11-186),0,1000,3000,0,0,4000,186,Joint Congressional Committee on Inaugural Ceremonies of 2025,1,Legislative Branch,account,11,Joint Items,1-11-186,Joint Congressional Committee on Inaugural Ceremonies of 2025
/US FEDERAL GOVERNMENT/[budget] Legislative Branch (1)/[budget] Joint Items (1-11)/[budget] Joint Committee on Taxation (1-11-460),[budget] Joint Committee on Taxation (1-11-460),11000,12000,12000,12000,13000,14000,460,Joint Committee on Taxation,1,Legislative Branch,account,11,Joint Items,1-11-460,Joint Committee on Taxation
/US FEDERAL GOVERNMENT/[budget] Legislative Branch (1)/[budget] Joint Items (1-11)/[budget] Joint Economic Committee (1-11-181),[budget] Joint Economic Committee (1-11-181),4000,4000,4000,3000,6000,4000,181,Joint Economic Committee,1,Legislative Branch,account,11,Joint Items,1-11-181,Joint Economic Committee
/US FEDERAL GOVERNMENT/[budget] Legislative Branch (1)/[budget] Joint Items (1-11)/[budget] Office of the Attending Physician (1-11-425),[budget] Office of the Attending Physician (1-11-425),5000,3000,6000,9000,9000,6000,425,Office of the Attending Physician,1,Legislative Branch,account,11,Joint Items,1-11-425,Office of the Attending Physician
/US FEDERAL GOVERNMENT/[budget] Legislative Branch (1)/[budget] Legislative Branch Boards and Commissions (1-45)/[budget] Commission on Security and Cooperation in Europe: (1-45-110),[budget] Commission on Security and Cooperation in Europe: (1-45-110),0,0,0,3000,3000,3000,110,Commission on Security and Cooperation in Europe:,1,Legislative Branch,account,45,Legislative Branch Boards and Commissions,1-45-110,Commission on Security and Cooperation in Europe:
/US FEDERAL GOVERNMENT/[budget] Legislative Branch (1)/[budget] Legislative Branch Boards and Commissions (1-45)/[budget] United States Semiquincentennial Commission (1-45-2780),[budget] United States Semiquincentennial Commission (1-45-2780),0,2000,8000,7000,8000,17000,2780,United States Semiquincentennial Commission,1,Legislative Branch,account,45,Legislative Branch Boards and Commissions,1-45-2780,United States Semiquincentennial Commission
/US FEDERAL GOVERNMENT/[budget] Legislative Branch (1)/[budget] Legislative Branch Boards and Commissions (1-45)/[budget] Congressional Executive Commission on the People's Republic of China (1-45-2930),[budget] Congressional Executive Commission on the People's Republic of China (1-45-2930),0,0,0,2000,3000,2000,2930,Congressional Executive Commission on the People's Republic of China,1,Legislative Branch,account,45,Legislative Branch Boards and Commissions,1-45-2930,Congressional Executive Commission on the People's Republic of China
/US FEDERAL GOVERNMENT/[budget] Legislative Branch (1)/[budget] Legislative Branch Boards and Commissions (1-45)/[budget] John C. Stennis Center for Public Service Training and Development (1-45-8275),[budget] John C. Stennis Center for Public Service Training and Development (1-45-8275),2000,1000,1000,1000,1000,1000,8275,John C. Stennis Center for Public Service Training and Development,1,Legislative Branch,account,45,Legislative Branch Boards and Commissions,1-45-8275,John C. Stennis Center for Public Service Training and Development
/US FEDERAL GOVERNMENT/[budget] Legislative Branch (1)/[budget] Legislative Branch Boards and Commissions (1-45)/[budget] World War I Centennial Commission (1-45-5589),[budget] World War I Centennial Commission (1-45-5589),0,22000,6000,2000,1000,3000,5589,World War I Centennial Commission,1,Legislative Branch,account,45,Legislative Branch Boards and Commissions,1-45-5589,World War I Centennial Commission
/US FEDERAL GOVERNMENT/[budget] Legislative Branch (1)/[budget] Legislative Branch Boards and Commissions (1-45)/[budget] Medicaid and CHIP Payment and Access Commission (1-45-1801),[budget] Medicaid and CHIP Payment and Access Commission (1-45-1801),8000,9000,9000,9000,11000,10000,1801,Medicaid and CHIP Payment and Access Commission,1,Legislative Branch,account,45,Legislative Branch Boards and Commissions,1-45-1801,Medicaid and CHIP Payment and Access Commission
/US FEDERAL GOVERNMENT/[budget] Legislative Branch (1)/[budget] Legislative Branch Boards and Commissions (1-45)/[budget] United States-China Economic and Security Review Commission (1-45-2973),[budget] United States-China Economic and Security Review Commission (1-45-2973),3000,4000,4000,4000,4000,4000,2973,United States-China Economic and Security Review Commission,1,Legislative Branch,account,45,Legislative Branch Boards and Commissions,1-45-2973,United States-China Economic and Security Review Commission
/US FEDERAL GOVERNMENT/[budget] Legislative Branch (1)/[budget] Legislative Branch Boards and Commissions (1-45)/[budget] United States Commission on International Religious Freedom (1-45-2975),[budget] United States Commission on International Religious Freedom (1-45-2975),4000,4000,4000,5000,4000,4000,2975,United States Commission on International Religious Freedom,1,Legislative Branch,account,45,Legislative Branch Boards and Commissions,1-45-2975,United States Commission on International Religious Freedom
/US FEDERAL GOVERNMENT/[budget] Legislative Branch (1)/[budget] Government Publishing Office (1-30)/[budget] Government Publishing Office Business Operations Revolving (1-30-4505),[budget] Government Publishing Office Business Operations Revolving (1-30-4505),-16000,30000,-89000,-25000,46000,62000,4505,Government Publishing Office Business Operations Revolving,1,Legislative Branch,account,30,Government Publishing Office,1-30-4505,Government Publishing Office Business Operations Revolving
/US FEDERAL GOVERNMENT/[budget] Legislative Branch (1)/[budget] Senate (1-5)/[budget] Senators' Official Personnel and Office Expense (1-5-130),[budget] Senators' Official Personnel and Office Expense (1-5-130),432000,455000,466000,494000,575000,561000,130,Senators' Official Personnel and Office Expense,1,Legislative Branch,account,5,Senate,1-5-130,Senators' Official Personnel and Office Expense
/US FEDERAL GOVERNMENT/[budget] Legislative Branch (1)/[budget] Senate (1-5)/[budget] Office of the Legislative Counsel of the Senate (1-5-185),[budget] Office of the Legislative Counsel of the Senate (1-5-185),6000,6000,7000,7000,9000,9000,185,Office of the Legislative Counsel of the Senate,1,Legislative Branch,account,5,Senate,1-5-185,Office of the Legislative Counsel of the Senate
/US FEDERAL GOVERNMENT/[budget] Legislative Branch (1)/[budget] Library of Congress (1-25)/[budget] Cooperative Acquisitions Program Revolving (1-25-4325),[budget] Cooperative Acquisitions Program Revolving (1-25-4325),0,0,0,0,1000,1000,4325,Cooperative Acquisitions Program Revolving,1,Legislative Branch,account,25,Library of Congress,1-25-4325,Cooperative Acquisitions Program Revolving
/US FEDERAL GOVERNMENT/[budget] Legislative Branch (1)/[budget] Library of Congress (1-25)/[budget] Copyright Office (1-25-102),[budget] Copyright Office (1-25-102),37000,41000,44000,53000,53000,58000,102,Copyright Office,1,Legislative Branch,account,25,Library of Congress,1-25-102,Copyright Office
/US FEDERAL GOVERNMENT/[budget] Legislative Branch (1)/[budget] Architect of the Capitol (1-15)/[budget] Senate Office Buildings (1-15-123),[budget] Senate Office Buildings (1-15-123),105000,106000,122000,101000,141000,160000,123,Senate Office Buildings,1,Legislative Branch,account,15,Architect of the Capitol,1-15-123,Senate Office Buildings
/US FEDERAL GOVERNMENT/[budget] Legislative Branch (1)/[budget] Architect of the Capitol (1-15)/[budget] Capitol Visitor Center (1-15-161),[budget] Capitol Visitor Center (1-15-161),23000,24000,23000,25000,26000,32000,161,Capitol Visitor Center,1,Legislative Branch,account,15,Architect of the Capitol,1-15-161,Capitol Visitor Center
/US FEDERAL GOVERNMENT/[budget] Legislative Branch (1)/[budget] Architect of the Capitol (1-15)/[budget] House Office Buildings (1-15-127),[budget] House Office Buildings (1-15-127),157000,234000,195000,201000,146000,183000,127,House Office Buildings,1,Legislative Branch,account,15,Architect of the Capitol,1-15-127,House Office Buildings
"/US FEDERAL GOVERNMENT/[budget] Department of Labor (12)/[budget] Employment and Training Administration (12-5)/[budget] Federal Additional Unemployment Compensation Program, Recovery (12-5-1800)","[budget] Federal Additional Unemployment Compensation Program, Recovery (12-5-1800)",-3000,275020000,162698000,3612000,1608000,1014000,1800,"Federal Additional Unemployment Compensation Program, Recovery",12,Department of Labor,account,5,Employment and Training Administration,12-5-1800,"Federal Additional Unemployment Compensation Program, Recovery"
/US FEDERAL GOVERNMENT/[budget] Department of Labor (12)/[budget] Employment and Training Administration (12-5)/[budget] Program Administration (12-5-172),[budget] Program Administration (12-5-172),104000,119000,108000,127000,135000,154000,172,Program Administration,12,Department of Labor,account,5,Employment and Training Administration,12-5-172,Program Administration
/US FEDERAL GOVERNMENT/[budget] Department of Labor (12)/[budget] Office of Workers' Compensation Programs (12-15)/[budget] Panama Canal Commission Compensation (12-15-5155),[budget] Panama Canal Commission Compensation (12-15-5155),4000,4000,4000,4000,4000,2000,5155,Panama Canal Commission Compensation,12,Department of Labor,account,15,Office of Workers' Compensation Programs,12-15-5155,Panama Canal Commission Compensation
/US FEDERAL GOVERNMENT/[budget] Department of Labor (12)/[budget] Departmental Management (12-25)/[budget] Office of Disability Employment Policy (12-25-166),[budget] Office of Disability Employment Policy (12-25-166),39000,39000,-15000,51000,75000,50000,166,Office of Disability Employment Policy,12,Department of Labor,account,25,Departmental Management,12-25-166,Office of Disability Employment Policy
/US FEDERAL GOVERNMENT/[budget] Department of Labor (12)/[budget] Departmental Management (12-25)/[budget] Office of Inspector General (12-25-106),[budget] Office of Inspector General (12-25-106),84000,83000,88000,98000,91000,105000,106,Office of Inspector General,12,Department of Labor,account,25,Departmental Management,12-25-106,Office of Inspector General
/US FEDERAL GOVERNMENT/[budget] Department of Veterans Affairs (29)/[budget] Benefits Programs (29-25)/[budget] Veterans Housing Benefit Program (29-25-1119),[budget] Veterans Housing Benefit Program (29-25-1119),392000,243000,728000,2122000,1280000,320000,1119,Veterans Housing Benefit Program,29,Department of Veterans Affairs,account,25,Benefits Programs,29-25-1119,Veterans Housing Benefit Program
/US FEDERAL GOVERNMENT/[budget] Department of Veterans Affairs (29)/[budget] Benefits Programs (29-25)/[budget] Native American Veteran Housing Loan Program (29-25-1120),[budget] Native American Veteran Housing Loan Program (29-25-1120),4000,3000,2000,5000,7000,3000,1120,Native American Veteran Housing Loan Program,29,Department of Veterans Affairs,account,25,Benefits Programs,29-25-1120,Native American Veteran Housing Loan Program
/US FEDERAL GOVERNMENT/[budget] Department of Veterans Affairs (29)/[budget] Departmental Administration (29-40)/[budget] Office of Inspector General (29-40-170),[budget] Office of Inspector General (29-40-170),189000,213000,224000,250000,238000,282000,170,Office of Inspector General,29,Department of Veterans Affairs,account,40,Departmental Administration,29-40-170,Office of Inspector General
/US FEDERAL GOVERNMENT/[budget] Alyce Spotted Bear and Walter Soboleff Commission on Native Children (545)/[budget] Alyce Spotted Bear and Walter Soboleff Com. on Native Children (545-0)/[budget] Alyce Spotted Bear and Walter Soboleff Commission on Native Children (545-0-2987),[budget] Alyce Spotted Bear and Walter Soboleff Commission on Native Children (545-0-2987),0,0,0,1000,1000,1000,2987,Alyce Spotted Bear and Walter Soboleff Commission on Native Children,545,Alyce Spotted Bear and Walter Soboleff Commission on Native Children,account,0,Alyce Spotted Bear and Walter Soboleff Com. on Native Children,545-0-2987,Alyce Spotted Bear and Walter Soboleff Commission on Native Children
/US FEDERAL GOVERNMENT/[budget] Department of Health and Human Services (9)/[budget] Office of the Inspector General (9-92)/[budget] Office of Inspector General (9-92-128),[budget] Office of Inspector General (9-92-128),92000,52000,116000,111000,123000,123000,128,Office of Inspector General,9,Department of Health and Human Services,account,92,Office of the Inspector General,9-92-128,Office of Inspector General
/US FEDERAL GOVERNMENT/[budget] Department of Health and Human Services (9)/[budget] Departmental Management (9-90)/[budget] National Hepatitis C Elimination Program (9-90-102),[budget] National Hepatitis C Elimination Program (9-90-102),0,0,0,0,0,1134000,102,National Hepatitis C Elimination Program,9,Department of Health and Human Services,account,90,Departmental Management,9-90-102,National Hepatitis C Elimination Program
/US FEDERAL GOVERNMENT/[budget] Department of Health and Human Services (9)/[budget] Departmental Management (9-90)/[budget] PrEP Delivery Program to End the HIV Epidemic in the United States (9-90-151),[budget] PrEP Delivery Program to End the HIV Epidemic in the United States (9-90-151),0,0,0,0,0,213000,151,PrEP Delivery Program to End the HIV Epidemic in the United States,9,Department of Health and Human Services,account,90,Departmental Management,9-90-151,PrEP Delivery Program to End the HIV Epidemic in the United States
/US FEDERAL GOVERNMENT/[budget] Department of Health and Human Services (9)/[budget] Departmental Management (9-90)/[budget] Office for Civil Rights (9-90-135),[budget] Office for Civil Rights (9-90-135),28000,27000,44000,60000,44000,73000,135,Office for Civil Rights,9,Department of Health and Human Services,account,90,Departmental Management,9-90-135,Office for Civil Rights
/US FEDERAL GOVERNMENT/[budget] Department of Health and Human Services (9)/[budget] Centers for Medicare and Medicaid Services (9-38)/[budget] Pre-Existing Condition Insurance Plan Program (9-38-113),[budget] Pre-Existing Condition Insurance Plan Program (9-38-113),52000,53000,54000,62000,66000,26000,113,Pre-Existing Condition Insurance Plan Program,9,Department of Health and Human Services,account,38,Centers for Medicare and Medicaid Services,9-38-113,Pre-Existing Condition Insurance Plan Program
/US FEDERAL GOVERNMENT/[budget] Department of Health and Human Services (9)/[budget] Centers for Medicare and Medicaid Services (9-38)/[budget] Risk Adjustment Program Payments (9-38-5733),[budget] Risk Adjustment Program Payments (9-38-5733),6911000,5874000,6975000,6619000,8859000,9223000,5733,Risk Adjustment Program Payments,9,Department of Health and Human Services,account,38,Centers for Medicare and Medicaid Services,9-38-5733,Risk Adjustment Program Payments
/US FEDERAL GOVERNMENT/[budget] Department of Health and Human Services (9)/[budget] Centers for Medicare and Medicaid Services (9-38)/[budget] Center for Medicare and Medicaid Innovation (9-38-522),[budget] Center for Medicare and Medicaid Innovation (9-38-522),978000,792000,728000,682000,1005000,789000,522,Center for Medicare and Medicaid Innovation,9,Department of Health and Human Services,account,38,Centers for Medicare and Medicaid Services,9-38-522,Center for Medicare and Medicaid Innovation
/US FEDERAL GOVERNMENT/[budget] Department of Health and Human Services (9)/[budget] Centers for Medicare and Medicaid Services (9-38)/[budget] Early Retiree Reinsurance Program (9-38-114),[budget] Early Retiree Reinsurance Program (9-38-114),0,0,0,0,2000,23000,114,Early Retiree Reinsurance Program,9,Department of Health and Human Services,account,38,Centers for Medicare and Medicaid Services,9-38-114,Early Retiree Reinsurance Program
/US FEDERAL GOVERNMENT/[budget] Department of Health and Human Services (9)/[budget] Centers for Medicare and Medicaid Services (9-38)/[budget] Program Management (9-38-511),[budget] Program Management (9-38-511),-673000,-374000,-437000,-576000,609000,397000,511,Program Management,9,Department of Health and Human Services,account,38,Centers for Medicare and Medicaid Services,9-38-511,Program Management
/US FEDERAL GOVERNMENT/[budget] Department of Health and Human Services (9)/[budget] Centers for Disease Control and Prevention (9-20)/[budget] World Trade Center Health Program (9-20-946),[budget] World Trade Center Health Program (9-20-946),420000,430000,479000,512000,585000,1060000,946,World Trade Center Health Program,9,Department of Health and Human Services,account,20,Centers for Disease Control and Prevention,9-20-946,World Trade Center Health Program
/US FEDERAL GOVERNMENT/[budget] Department of Health and Human Services (9)/[budget] Centers for Disease Control and Prevention (9-20)/[budget] CDC-wide Activities and Program Support (9-20-943),[budget] CDC-wide Activities and Program Support (9-20-943),7212000,8116000,10778000,15898000,12373000,12234000,943,CDC-wide Activities and Program Support,9,Department of Health and Human Services,account,20,Centers for Disease Control and Prevention,9-20-943,CDC-wide Activities and Program Support
/US FEDERAL GOVERNMENT/[budget] Department of Health and Human Services (9)/[budget] Health Resources and Services Administration (9-15)/[budget] Vaccine Injury Compensation Program Trust (9-15-8175),[budget] Vaccine Injury Compensation Program Trust (9-15-8175),251000,240000,275000,254000,338000,330000,8175,Vaccine Injury Compensation Program Trust,9,Department of Health and Human Services,account,15,Health Resources and Services Administration,9-15-8175,Vaccine Injury Compensation Program Trust
/US FEDERAL GOVERNMENT/[budget] Federal Deposit Insurance Corporation (357)/[budget] FDIC_Office of Inspector General (357-40)/[budget] Office of the Inspector General (357-40-4595),[budget] Office of the Inspector General (357-40-4595),37000,39000,42000,45000,48000,50000,4595,Office of the Inspector General,357,Federal Deposit Insurance Corporation,account,40,FDIC_Office of Inspector General,357-40-4595,Office of the Inspector General
/US FEDERAL GOVERNMENT/[budget] Institute of American Indian and Alaska Native Culture and Arts Development (373)/[budget] Institute of American Indian and Alaska Native Culture and Arts Development (373-0)/[budget] Payment to the Institute (373-0-2900),[budget] Payment to the Institute (373-0-2900),10000,11000,11000,12000,13000,14000,2900,Payment to the Institute,373,Institute of American Indian and Alaska Native Culture and Arts Development,account,0,Institute of American Indian and Alaska Native Culture and Arts Development,373-0-2900,Payment to the Institute
/US FEDERAL GOVERNMENT/[budget] National Aeronautics and Space Administration (26)/[budget] National Aeronautics and Space Administration (26-0)/[budget] Office of Inspector General (26-0-109),[budget] Office of Inspector General (26-0-109),37000,40000,42000,46000,48000,50000,109,Office of Inspector General,26,National Aeronautics and Space Administration,account,0,National Aeronautics and Space Administration,26-0-109,Office of Inspector General
/US FEDERAL GOVERNMENT/[budget] Corps of Engineers--Civil Works (202)/[budget] Corps of Engineers--Civil Works (202-0)/[budget] Water Infrastructure Finance and Innovation Program (202-0-3139),[budget] Water Infrastructure Finance and Innovation Program (202-0-3139),0,0,0,2000,1000,1000,3139,Water Infrastructure Finance and Innovation Program,202,Corps of Engineers--Civil Works,account,0,Corps of Engineers--Civil Works,202-0-3139,Water Infrastructure Finance and Innovation Program
/US FEDERAL GOVERNMENT/[budget] Corps of Engineers--Civil Works (202)/[budget] Corps of Engineers--Civil Works (202-0)/[budget] Office of the Assistant Secretary of the Army for Civil Works (202-0-3132),[budget] Office of the Assistant Secretary of the Army for Civil Works (202-0-3132),4000,5000,4000,5000,5000,5000,3132,Office of the Assistant Secretary of the Army for Civil Works,202,Corps of Engineers--Civil Works,account,0,Corps of Engineers--Civil Works,202-0-3132,Office of the Assistant Secretary of the Army for Civil Works
/US FEDERAL GOVERNMENT/[budget] Corps of Engineers--Civil Works (202)/[budget] Corps of Engineers--Civil Works (202-0)/[budget] Regulatory Program (202-0-3126),[budget] Regulatory Program (202-0-3126),204000,206000,205000,208000,207000,207000,3126,Regulatory Program,202,Corps of Engineers--Civil Works,account,0,Corps of Engineers--Civil Works,202-0-3126,Regulatory Program
/US FEDERAL GOVERNMENT/[budget] Corps of Engineers--Civil Works (202)/[budget] Corps of Engineers--Civil Works (202-0)/[budget] Formerly Utilized Sites Remedial Action Program (202-0-3130),[budget] Formerly Utilized Sites Remedial Action Program (202-0-3130),135000,161000,168000,174000,168000,170000,3130,Formerly Utilized Sites Remedial Action Program,202,Corps of Engineers--Civil Works,account,0,Corps of Engineers--Civil Works,202-0-3130,Formerly Utilized Sites Remedial Action Program
/US FEDERAL GOVERNMENT/[budget] Department of Agriculture (5)/[budget] Office of the Secretary (5-3)/[budget] Food Supply Chain and Agriculture Pandemic Response Program (5-3-408),[budget] Food Supply Chain and Agriculture Pandemic Response Program (5-3-408),0,0,0,25000,1134000,1081000,408,Food Supply Chain and Agriculture Pandemic Response Program,5,Department of Agriculture,account,3,Office of the Secretary,5-3-408,Food Supply Chain and Agriculture Pandemic Response Program
/US FEDERAL GOVERNMENT/[budget] Department of Agriculture (5)/[budget] Rural Housing Service (5-63)/[budget] Rental Assistance Program (5-63-137),[budget] Rental Assistance Program (5-63-137),1193000,1153000,1346000,1337000,1820000,1689000,137,Rental Assistance Program,5,Department of Agriculture,account,63,Rural Housing Service,5-63-137,Rental Assistance Program
