,,,US FEDERAL GOVERNMENT,,,,,,,,,,,
17,Social Security Administration,Social Security Administration,Social Security Administration,1300798000,1408433000,1008279000,1170139000,0,,bureau,1099724000,1055923000,,17-0
302,Administrative Conference of the United States,Administrative Conference of the United States,Administrative Conference of the United States,3000,4000,3000,4000,0,,bureau,3000,3000,,302-0
543,National Association of Registered Agents and Brokers,National Association of Registered Agents and Brokers,National Association of Registered Agents and Brokers,2000,2000,0,0,0,,bureau,0,0,,543-0
154,Federal Drug Control Programs,Federal Drug Control Programs,Federal Drug Control Programs,541000,401000,332000,407000,0,,bureau,409000,342000,,154-0
18,Department of Education,Office of Innovation and Improvement,Office of Innovation and Improvement,1547000,1528000,952000,818000,12,,bureau,893000,887000,,18-12
18,Department of Education,Disaster Education Recovery,Disaster Education Recovery,206000,27000,368000,94000,85,,bureau,295000,279000,,18-85
18,Department of Education,Office of Federal Student Aid,Office of Federal Student Aid,105860000,55951000,69396000,539830000,45,,bureau,170470000,160914000,,18-45
18,Department of Education,Office of Postsecondary Education,Office of Postsecondary Education,3808000,4027000,2733000,3022000,40,,bureau,4440000,2651000,,18-40
18,Department of Education,Institute of Education Sciences,Institute of Education Sciences,638000,774000,651000,659000,50,,bureau,555000,576000,,18-50
18,Department of Education,Departmental Management,Departmental Management,739000,783000,602000,607000,80,,bureau,635000,577000,,18-80
18,Department of Education,Office of Elementary and Secondary Education,Office of Elementary and Secondary Education,107736000,88764000,22757000,102808000,10,,bureau,71347000,33536000,,18-10
18,Department of Education,Office of Special Education and Rehabilitative Services,Office of Special Education and Rehabilitative Services,16973000,18094000,16582000,17974000,20,,bureau,15940000,16269000,,18-20
18,Department of Education,Office of English Language Acquisition,Office of English Language Acquisition,551000,850000,749000,753000,15,,bureau,672000,681000,,18-15
18,Department of Education,"Office of Career, Technical, and Adult Education","Office of Career, Technical, and Adult Education",1861000,2054000,1798000,1887000,30,,bureau,1827000,1709000,,18-30
21,Department of Transportation,Federal Highway Administration,Federal Highway Administration,58224000,65755000,45712000,50137000,15,,bureau,47614000,48743000,,21-15
21,Department of Transportation,Federal Transit Administration,Federal Transit Administration,20315000,20105000,13371000,34077000,36,,bureau,24371000,25375000,,21-36
21,Department of Transportation,Office of the Secretary,Office of the Secretary,2547000,2701000,896000,2244000,4,,bureau,2551000,1185000,,21-4
21,Department of Transportation,Great Lakes St. Lawrence Seaway Development Corporation,Great Lakes St. Lawrence Seaway Development Corporation,50000,40000,39000,33000,40,,bureau,36000,35000,,21-40
21,Department of Transportation,Federal Railroad Administration,Federal Railroad Administration,4253000,5591000,2262000,2759000,27,,bureau,5054000,3344000,,21-27
21,Department of Transportation,Maritime Administration,Maritime Administration,1179000,1211000,552000,739000,70,,bureau,924000,664000,,21-70
21,Department of Transportation,Federal Aviation Administration,Federal Aviation Administration,26317000,26960000,16670000,23071000,12,,bureau,23023000,20363000,,21-12
21,Department of Transportation,National Highway Traffic Safety Administration,National Highway Traffic Safety Administration,1471000,1660000,1028000,1114000,18,,bureau,1081000,970000,,21-18
21,Department of Transportation,Federal Motor Carrier Safety Administration,Federal Motor Carrier Safety Administration,981000,1118000,585000,703000,17,,bureau,567000,617000,,21-17
21,Department of Transportation,Office of Inspector General,Office of Inspector General,112000,122000,96000,101000,56,,bureau,95000,93000,,21-56
21,Department of Transportation,Pipeline and Hazardous Materials Safety Administration,Pipeline and Hazardous Materials Safety Administration,316000,442000,257000,280000,50,,bureau,270000,272000,,21-50
372,Harry S Truman Scholarship Foundation,Harry S Truman Scholarship Foundation,Harry S Truman Scholarship Foundation,3000,3000,2000,2000,0,,bureau,2000,2000,,372-0
432,Occupational Safety and Health Review Commission,Occupational Safety and Health Review Commission,Occupational Safety and Health Review Commission,16000,16000,12000,13000,0,,bureau,13000,13000,,432-0
236,"National Commission on Military, National, and Public Service","National Commission on Military, National, and Public Service","National Commission on Military, National, and Public Service",6000,3000,1000,0,0,,bureau,0,4000,,236-0
366,Federal Maritime Commission,Federal Maritime Commission,Federal Maritime Commission,40000,44000,27000,29000,0,,bureau,30000,27000,,366-0
456,United States Holocaust Memorial Museum,United States Holocaust Memorial Museum,United States Holocaust Memorial Museum,72000,65000,53000,63000,0,,bureau,59000,55000,,456-0
569,Southwest Border Regional Commission,Southwest Border Regional Commission,Southwest Border Regional Commission,0,3000,0,0,0,,bureau,0,0,,569-0
356,Federal Communications Commission,Federal Communications Commission,Federal Communications Commission,20117000,19623000,10527000,15196000,0,,bureau,11117000,10243000,,356-0
25,Department of Housing and Urban Development,Fair Housing and Equal Opportunity,Fair Housing and Equal Opportunity,79000,83000,60000,65000,29,,bureau,66000,65000,,25-29
25,Department of Housing and Urban Development,Policy Development and Research,Policy Development and Research,128000,130000,76000,52000,28,,bureau,73000,68000,,25-28
25,Department of Housing and Urban Development,Management and Administration,Management and Administration,2395000,2426000,1679000,2010000,35,,bureau,1948000,1799000,,25-35
25,Department of Housing and Urban Development,Community Planning and Development,Community Planning and Development,20284000,23354000,8787000,13273000,6,,bureau,11488000,8824000,,25-6
25,Department of Housing and Urban Development,Public and Indian Housing Programs,Public and Indian Housing Programs,39402000,43862000,29828000,35159000,3,,bureau,33704000,32390000,,25-3
25,Department of Housing and Urban Development,Office of Lead Hazard Control and Healthy Homes,Office of Lead Hazard Control and Healthy Homes,200000,318000,95000,115000,32,,bureau,90000,81000,,25-32
25,Department of Housing and Urban Development,Housing Programs,Housing Programs,4684000,10195000,-9412000,-12568000,9,,bureau,-6703000,-3260000,,25-9
309,Appalachian Regional Commission,Appalachian Regional Commission,Appalachian Regional Commission,249000,336000,108000,129000,0,,bureau,124000,142000,,309-0
306,Advisory Council on Historic Preservation,Advisory Council on Historic Preservation,Advisory Council on Historic Preservation,11000,10000,10000,7000,0,,bureau,8000,8000,,306-0
449,Securities and Exchange Commission,Securities and Exchange Commission,Securities and Exchange Commission,736000,377000,369000,775000,0,,bureau,495000,-533000,,449-0
431,Nuclear Waste Technical Review Board,Nuclear Waste Technical Review Board,Nuclear Waste Technical Review Board,4000,4000,3000,5000,0,,bureau,4000,3000,,431-0
11,Department of Justice,"State, Local, and Tribal Justice Assistance","State, Local, and Tribal Justice Assistance",11628000,8272000,4567000,5360000,21,,bureau,4940000,5624000,,11-21
11,Department of Justice,"Bureau of Alcohol, Tobacco, Firearms, and Explosives","Bureau of Alcohol, Tobacco, Firearms, and Explosives",1742000,1899000,1320000,1480000,14,,bureau,1434000,1352000,,11-14
11,Department of Justice,Federal Prison System,Federal Prison System,8689000,8615000,7091000,7540000,20,,bureau,7670000,7764000,,11-20
11,Department of Justice,National Security Division,National Security Division,138000,144000,100000,118000,8,,bureau,98000,104000,,11-8
11,Department of Justice,Federal Bureau of Investigation,Federal Bureau of Investigation,11395000,12564000,9353000,10276000,10,,bureau,10133000,9823000,,11-10
11,Department of Justice,Radiation Exposure Compensation,Radiation Exposure Compensation,86000,80000,63000,67000,6,,bureau,48000,58000,,11-6
11,Department of Justice,Legal Activities and U.S. Marshals,Legal Activities and U.S. Marshals,12517000,12599000,11380000,10727000,5,,bureau,11787000,11964000,,11-5
11,Department of Justice,United States Parole Commission,United States Parole Commission,19000,15000,13000,9000,4,,bureau,11000,11000,,11-4
11,Department of Justice,Interagency Law Enforcement,Interagency Law Enforcement,499000,503000,523000,565000,7,,bureau,553000,582000,,11-7
11,Department of Justice,Drug Enforcement Administration,Drug Enforcement Administration,3230000,3248000,2704000,2978000,12,,bureau,2938000,2813000,,11-12
11,Department of Justice,"Justice Operations, Management, and Accountability","Justice Operations, Management, and Accountability",1194000,1967000,790000,1156000,3,,bureau,962000,714000,,11-3
15,Department of the Treasury,Departmental Offices,Departmental Offices,14554000,7764000,3157000,136688000,5,,bureau,302141000,210557000,,15-5
15,Department of the Treasury,Fiscal Service,Fiscal Service,16222000,17606000,15384000,20041000,12,,bureau,24736000,37205000,,15-12
15,Department of the Treasury,Financial Crimes Enforcement Network,Financial Crimes Enforcement Network,202000,192000,119000,142000,4,,bureau,136000,120000,,15-4
15,Department of the Treasury,Interest on the Public Debt,Interest on the Public Debt,897717000,1006910000,572913000,717611000,60,,bureau,562388000,522652000,,15-60
15,Department of the Treasury,Alcohol and Tobacco Tax and Trade Bureau,Alcohol and Tobacco Tax and Trade Bureau,542000,556000,559000,542000,13,,bureau,640000,590000,,15-13
15,Department of the Treasury,Bureau of Engraving and Printing,Bureau of Engraving and Printing,132000,499000,-55000,-39000,20,,bureau,70000,74000,,15-20
15,Department of the Treasury,Internal Revenue Service,Internal Revenue Service,228729000,456971000,166003000,352121000,45,,bureau,817463000,448970000,,15-45
19,Department of Energy,Departmental Administration,Departmental Administration,597000,564000,261000,245000,60,,bureau,264000,198000,,19-60
19,Department of Energy,Environmental and Other Defense Activities,Environmental and Other Defense Activities,9484000,9901000,6505000,7758000,10,,bureau,6962000,6902000,,19-10
19,Department of Energy,National Nuclear Security Administration,National Nuclear Security Administration,20646000,21688000,14314000,18150000,5,,bureau,16545000,15438000,,19-5
19,Department of Energy,Energy Programs,Energy Programs,18199000,30973000,11562000,3423000,20,,bureau,13585000,12406000,,19-20
339,Commodity Futures Trading Commission,Commodity Futures Trading Commission,Commodity Futures Trading Commission,422000,296000,261000,126000,0,,bureau,314000,316000,,339-0
535,Privacy and Civil Liberties Oversight Board,Privacy and Civil Liberties Oversight Board,Privacy and Civil Liberties Oversight Board,11000,12000,7000,11000,0,,bureau,9000,10000,,535-0
313,Barry Goldwater Scholarship and Excellence in Education Foundation,Barry Goldwater Scholarship and Excellence in Education Foundation,Barry Goldwater Scholarship and Excellence in Education Foundation,2000,2000,-5000,3000,0,,bureau,4000,4000,,313-0
6,Department of Commerce,National Institute of Standards and Technology,National Institute of Standards and Technology,1896000,3629000,1025000,1238000,55,,bureau,1116000,1046000,,6-55
6,Department of Commerce,Economic Development Administration,Economic Development Administration,1527000,2081000,264000,935000,6,,bureau,791000,352000,,6-6
6,Department of Commerce,National Telecommunications and Information Administration,National Telecommunications and Information Administration,1478000,2644000,1466000,1068000,60,,bureau,1506000,1508000,,6-60
6,Department of Commerce,Bureau of the Census,Bureau of the Census,2208000,1659000,2528000,1618000,7,,bureau,3025000,6666000,,6-7
6,Department of Commerce,Bureau of Industry and Security,Bureau of Industry and Security,201000,213000,113000,145000,30,,bureau,138000,125000,,6-30
6,Department of Commerce,Minority Business Development Agency,Minority Business Development Agency,64000,111000,37000,56000,40,,bureau,49000,42000,,6-40
6,Department of Commerce,National Oceanic and Atmospheric Administration,National Oceanic and Atmospheric Administration,7480000,8746000,5332000,6269000,48,,bureau,5826000,5739000,,6-48
6,Department of Commerce,Bureau of Economic Analysis,Bureau of Economic Analysis,130000,152000,104000,112000,8,,bureau,107000,107000,,6-8
6,Department of Commerce,U.S. Patent and Trademark Office,U.S. Patent and Trademark Office,-62000,260000,-79000,-367000,51,,bureau,-75000,-265000,,6-51
6,Department of Commerce,Departmental Management,Departmental Management,365000,199000,106000,136000,5,,bureau,153000,97000,,6-5
6,Department of Commerce,International Trade Administration,International Trade Administration,583000,653000,466000,542000,25,,bureau,525000,506000,,6-25
6,Department of Commerce,National Technical Information Service,National Technical Information Service,5000,5000,0,-1000,54,,bureau,-3000,0,,6-54
513,Denali Commission,Denali Commission,Denali Commission,48000,47000,21000,3000,0,,bureau,16000,40000,,513-0
344,Corporation for Public Broadcasting,Corporation for Public Broadcasting,Corporation for Public Broadcasting,525000,583000,465000,485000,0,,bureau,640000,540000,,344-0
247,400 Years of African-American History Commission,400 Years of African-American History Commission,400 Years of African-American History Commission,3000,3000,0,2000,0,,bureau,2000,1000,,247-0
323,Commission of Fine Arts,Commission of Fine Arts,Commission of Fine Arts,9000,9000,7000,8000,0,,bureau,8000,8000,,323-0
20,Environmental Protection Agency,Environmental Protection Agency,Environmental Protection Agency,20265000,38526000,8062000,9281000,0,,bureau,8309000,8725000,,20-0
473,Federal Permitting Improvement Steering Council,Federal Permitting Improvement Council,Federal Permitting Improvement Council,25000,36000,0,6000,0,,bureau,8000,4000,,473-0
467,Intelligence Community Management Account,Intelligence Community Management Account,Intelligence Community Management Account,522000,629000,524000,595000,0,,bureau,525000,511000,,467-0
2,Judicial Branch,United States Sentencing Commission,United States Sentencing Commission,25000,23000,18000,21000,39,,bureau,20000,19000,,2-39
2,Judicial Branch,United States Court of International Trade,United States Court of International Trade,24000,25000,21000,24000,15,,bureau,21000,25000,,2-15
2,Judicial Branch,United States Court of Appeals for the Federal Circuit,United States Court of Appeals for the Federal Circuit,41000,44000,34000,33000,7,,bureau,35000,37000,,2-7
2,Judicial Branch,Administrative Office of the United States Courts,Administrative Office of the United States Courts,103000,115000,90000,113000,26,,bureau,96000,97000,,2-26
2,Judicial Branch,Federal Judicial Center,Federal Judicial Center,35000,35000,30000,30000,30,,bureau,27000,27000,,2-30
2,Judicial Branch,Judicial Retirement Funds,Judicial Retirement Funds,178000,186000,151000,233000,35,,bureau,166000,157000,,2-35
2,Judicial Branch,"Courts of Appeals, District Courts, and Other Judicial Services","Courts of Appeals, District Courts, and Other Judicial Services",9361000,10556000,8215000,8889000,25,,bureau,8492000,8454000,,2-25
2,Judicial Branch,Supreme Court of the United States,Supreme Court of the United States,150000,152000,97000,124000,5,,bureau,106000,99000,,2-5
514,U.S. Agency for Global Media,U.S. Agency for Global Media,U.S. Agency for Global Media,882000,909000,813000,850000,0,,bureau,797000,797000,,514-0
435,Office of Navajo and Hopi Indian Relocation,Office of Navajo and Hopi Indian Relocation,Office of Navajo and Hopi Indian Relocation,1000,4000,5000,5000,0,,bureau,4000,5000,,435-0
526,Public Company Accounting Oversight Board,Public Company Accounting Oversight Board,Public Company Accounting Oversight Board,340000,341000,264000,295000,0,,bureau,273000,266000,,526-0
389,Merit Systems Protection Board,Merit Systems Protection Board,Merit Systems Protection Board,56000,58000,44000,45000,0,,bureau,44000,42000,,389-0
360,Federal Election Commission,Federal Election Commission,Federal Election Commission,94000,92000,65000,71000,0,,bureau,72000,74000,,360-0
573,Northern Border Regional Commission,Northern Border Regional Commission,Northern Border Regional Commission,35000,51000,6000,17000,0,,bureau,8000,5000,,573-0
28,Small Business Administration,Small Business Administration,Office of Inspector General,49000,60000,22000,36000,0,200,account,26000,23000,Office of Inspector General,28-0-200
28,Small Business Administration,Small Business Administration,Disaster Loans Program,30298000,530000,327000,17134000,0,1152,account,8462000,25129000,Disaster Loans Program,28-0-1152
28,Small Business Administration,Small Business Administration,Business Loans Program,410000,169000,243000,9902000,0,1154,account,296306000,533955000,Business Loans Program,28-0-1154
28,Small Business Administration,Small Business Administration,Entrepreneurial Development Program,575000,308000,232000,398000,0,400,account,235000,272000,Entrepreneurial Development Program,28-0-400
28,Small Business Administration,Small Business Administration,Office of Advocacy,10000,10000,10000,7000,0,300,account,8000,9000,Office of Advocacy,28-0-300
393,National Archives and Records Administration,National Archives and Records Administration,National Historical Publications and Records Commission,17000,27000,5000,6000,0,301,account,6000,6000,National Historical Publications and Records Commission,393-0-301
393,National Archives and Records Administration,National Archives and Records Administration,Office of the Inspector General--National Archives and Records Administration,6000,6000,4000,5000,0,305,account,5000,5000,Office of the Inspector General--National Archives and Records Administration,393-0-305
23,General Services Administration,General Activities,Office of Inspector General,71000,78000,65000,68000,30,108,account,67000,66000,Office of Inspector General,23-30-108
23,General Services Administration,General Activities,Allowances and Office Staff for Former Presidents,5000,6000,4000,5000,30,105,account,4000,3000,Allowances and Office Staff for Former Presidents,23-30-105
474,Institute of Museum and Library Services,Institute of Museum and Library Services,Office of Museum and Library Services: Grants and Administration,443000,350000,228000,358000,0,300,account,282000,234000,Office of Museum and Library Services: Grants and Administration,474-0-300
542,Council of the Inspectors General on Integrity and Efficiency,Council of the Inspectors General on Integrity and Efficiency,Inspectors General Council,7000,5000,0,-1000,0,4592,account,-1000,0,Inspectors General Council,542-0-4592
542,Council of the Inspectors General on Integrity and Efficiency,Council of the Inspectors General on Integrity and Efficiency,Pandemic Response Accountability Committee,31000,20000,0,29000,0,1654,account,16000,1000,Pandemic Response Accountability Committee,542-0-1654
422,National Science Foundation,National Science Foundation,Office of the National Science Board,5000,5000,5000,5000,0,350,account,4000,4000,Office of the National Science Board,422-0-350
422,National Science Foundation,National Science Foundation,Office of Inspector General,22000,26000,16000,19000,0,300,account,16000,16000,Office of Inspector General,422-0-300
27,Office of Personnel Management,Office of Personnel Management,Office of Inspector General,9000,7000,5000,7000,0,400,account,3000,7000,Office of Inspector General,27-0-400
27,Office of Personnel Management,Office of Personnel Management,Postal Service Health Benefits Program Implementation,62000,5000,0,1000,0,813,account,0,0,Postal Service Health Benefits Program Implementation,27-0-813
184,International Assistance Programs,Multilateral Assistance,Clean Technology Fund Program,25000,50000,0,0,10,80,account,0,0,Clean Technology Fund Program,184-10-80
184,International Assistance Programs,Multilateral Assistance,Global Agriculture and Food Security Program,10000,40000,0,155000,10,1475,account,0,15000,Global Agriculture and Food Security Program,184-10-1475
184,International Assistance Programs,Multilateral Assistance,International Affairs Technical Assistance Program,40000,37000,26000,35000,10,1045,account,29000,27000,International Affairs Technical Assistance Program,184-10-1045
184,International Assistance Programs,Agency for International Development,"Operating Expenses, Office of Inspector General",130000,87000,65000,73000,15,1007,account,80000,65000,"Operating Expenses, Office of Inspector General",184-15-1007
184,International Assistance Programs,Agency for International Development,Development Assistance Program,3470000,3674000,2529000,2857000,15,1021,account,2495000,2543000,Development Assistance Program,184-15-1021
184,International Assistance Programs,International Security Assistance,Foreign Military Financing Program,9307000,7931000,5464000,6750000,5,1082,account,5036000,6126000,Foreign Military Financing Program,184-5-1082
14,Department of State,Other,Center for Middle Eastern-Western Dialogue Trust,1000,1000,0,1000,25,8813,account,1000,0,Center for Middle Eastern-Western Dialogue Trust,14-25-8813
14,Department of State,Other,"International Center, Washington, D.C.",3000,2000,0,2000,25,5151,account,1000,1000,"International Center, Washington, D.C.",14-25-5151
14,Department of State,Other,East-West Center,27000,22000,18000,19000,25,202,account,17000,16000,East-West Center,14-25-202
14,Department of State,Administration of Foreign Affairs,Payment to the American Institute in Taiwan,44000,44000,21000,25000,5,523,account,29000,28000,Payment to the American Institute in Taiwan,14-5-523
14,Department of State,Administration of Foreign Affairs,Emergencies in the Diplomatic and Consular Service,150000,71000,30000,264000,5,522,account,95000,212000,Emergencies in the Diplomatic and Consular Service,14-5-522
14,Department of State,Administration of Foreign Affairs,Repatriation Loans Program,1000,2000,1000,2000,5,601,account,3000,2000,Repatriation Loans Program,14-5-601
14,Department of State,Administration of Foreign Affairs,Office of Inspector General,164000,134000,138000,133000,5,529,account,134000,144000,Office of Inspector General,14-5-529
537,Federal Housing Finance Agency,Federal Housing Finance Agency,Office of Inspector General,0,2000,1000,1000,0,5564,account,1000,-1000,Office of Inspector General,537-0-5564
16,Social Security Administration,Social Security Administration,Supplemental Security Income Program,65183000,62582000,60336000,65708000,0,406,account,60154000,60807000,Supplemental Security Income Program,16-0-406
16,Social Security Administration,Social Security Administration,Office of Inspector General,34000,34000,27000,26000,0,400,account,33000,30000,Office of Inspector General,16-0-400
24,Department of Homeland Security,Management Directorate,Federal Protective Service,390000,26000,-79000,-146000,15,542,account,-233000,-51000,Federal Protective Service,24-15-542
24,Department of Homeland Security,Federal Emergency Management Agency,Flood Hazard Mapping and Risk Analysis Program,5000,3000,42000,3000,70,500,account,14000,16000,Flood Hazard Mapping and Risk Analysis Program,24-70-500
24,Department of Homeland Security,Federal Emergency Management Agency,Disaster Assistance Direct Loan Program,72000,64000,160000,135000,70,703,account,162000,110000,Disaster Assistance Direct Loan Program,24-70-703
24,Department of Homeland Security,United States Secret Service,"Contribution for Annuity Benefits, United States Secret Service",271000,268000,238000,268000,40,405,account,267000,288000,"Contribution for Annuity Benefits, United States Secret Service",24-40-405
429,Nuclear Regulatory Commission,Nuclear Regulatory Commission,Office of Inspector General,16000,19000,11000,14000,0,300,account,13000,12000,Office of Inspector General,429-0-300
587,Public Defender Service for the District of Columbia,Public Defender Service for the District of Columbia,Federal Payment to the District of Columbia Public Defender Service,60000,59000,41000,48000,0,1733,account,44000,40000,Federal Payment to the District of Columbia Public Defender Service,587-0-1733
7,Department of Defense--Military Programs,Procurement,Defense Production Act Program,4000,4000,0,4000,15,361,account,6000,0,Defense Production Act Program,7-15-361
7,Department of Defense--Military Programs,Military Construction,North Atlantic Treaty Organization Security Investment Program,448000,438000,128000,171000,25,804,account,209000,86000,North Atlantic Treaty Organization Security Investment Program,7-25-804
7,Department of Defense--Military Programs,Operation and Maintenance,Defense Health Program,39365000,38674000,33801000,35926000,10,130,account,34911000,34094000,Defense Health Program,7-10-130
7,Department of Defense--Military Programs,Operation and Maintenance,Office of the Inspector General,415000,511000,355000,436000,10,107,account,409000,386000,Office of the Inspector General,7-10-107
485,Corporation for National and Community Service,Corporation for National and Community Service,Office of Inspector General,7000,8000,5000,7000,0,2721,account,5000,6000,Office of Inspector General,485-0-2721
1,Legislative Branch,Joint Items,Office of Congressional Accessibility Services,3000,2000,1000,2000,11,190,account,1000,1000,Office of Congressional Accessibility Services,1-11-190
